<?xml version="1.0" encoding="UTF-8"?>
<list xmlns:xsi="http://www.w3.org/2001/XMLSchema-instance" xsi:noNamespaceSchemaLocation="../../xsd/items.xsd">
	<item id="47927" name="Magic Fan - Blue" additionalName="Sealed" type="Weapon">
		<!-- A magic fan that can be used for making fire and cooling in hot weather. A beautiful accessory for every costume. <font color=ff6666><Unavailable to Sylphs/ Vanguard Riders/ Assassins.></font> -->
		<set name="icon" val="icon.ev_kr_13th_present_blue" />
		<set name="default_action" val="EQUIP" />
		<set name="weapon_type" val="BLUNT" />
		<set name="bodypart" val="rhand" />
		<set name="immediate_effect" val="true" />
		<set name="material" val="WOOD" />
		<set name="soulshots" val="1" />
		<set name="spiritshots" val="1" />
		<set name="is_tradable" val="false" />
		<set name="is_dropable" val="false" />
		<set name="is_sellable" val="false" />
		<set name="is_magic_weapon" val="true" />
		<set name="is_freightable" val="true" />
		<set name="weight" val="150" />
		<stats>
			<stat type="pAtk">1</stat>
			<stat type="mAtk">1</stat>
			<stat type="rCrit">6</stat>
			<stat type="accCombat">8</stat>
			<stat type="pAtkSpd">379</stat>
			<stat type="randomDamage">1</stat>
			<stat type="pAtkRange">40</stat>
		</stats>
	</item>
	<item id="47928" name="Magic Woodpile" type="EtcItem">
		<!-- Double-click to use a magic woodpile for one player. If you have the Magic Fan equipped, you can use the skills Breeze and Gust to set fire to the woodpile. -->
		<set name="icon" val="icon.ev_firewood_seed_solo" />
		<set name="default_action" val="SKILL_REDUCE" />
		<set name="is_stackable" val="true" />
		<set name="material" val="WOOD" />
	</item>
	<item id="47929" name="Large Magic Woodpile" type="EtcItem">
		<!-- Double-click to use a magic woodpile for party use. If you have the Magic Fan equipped, you can use the skills Breeze and Gust to set fire to the woodpile. -->
		<set name="icon" val="icon.ev_firewood_seed_party" />
		<set name="default_action" val="SKILL_REDUCE" />
		<set name="is_stackable" val="true" />
		<set name="material" val="WOOD" />
	</item>
	<item id="47945" name="Magic Fan - Yellow" additionalName="Sealed" type="Weapon">
		<!-- A magic fan that can be used for making fire and cooling in hot weather. A beautiful accessory for every costume. <font color=ff6666><Unavailable to Sylphs/ Vanguard Riders/ Assassins.></font> -->
		<set name="icon" val="icon.ev_kr_13th_present_yellow" />
		<set name="default_action" val="EQUIP" />
		<set name="weapon_type" val="BLUNT" />
		<set name="bodypart" val="rhand" />
		<set name="immediate_effect" val="true" />
		<set name="material" val="WOOD" />
		<set name="soulshots" val="1" />
		<set name="spiritshots" val="1" />
		<set name="is_tradable" val="false" />
		<set name="is_dropable" val="false" />
		<set name="is_sellable" val="false" />
		<set name="is_magic_weapon" val="true" />
		<set name="is_freightable" val="true" />
		<set name="weight" val="150" />
		<stats>
			<stat type="pAtk">1</stat>
			<stat type="mAtk">1</stat>
			<stat type="rCrit">6</stat>
			<stat type="accCombat">8</stat>
			<stat type="pAtkSpd">379</stat>
			<stat type="randomDamage">1</stat>
			<stat type="pAtkRange">40</stat>
		</stats>
	</item>
</list>
