<?xml version="1.0" encoding="UTF-8"?>
<list xmlns:xsi="http://www.w3.org/2001/XMLSchema-instance" xsi:noNamespaceSchemaLocation="../../xsd/items.xsd">
	<item id="39719" name="Monster Only: Kruk's Staff" additionalName="Sealed" type="Weapon">
		<!-- Monster weapon. -->
		<set name="icon" val="icon.wp_fishing4" />
		<set name="default_action" val="EQUIP" />
		<set name="weapon_type" val="POLE" />
		<set name="bodypart" val="lrhand" />
		<set name="immediate_effect" val="true" />
		<set name="crystal_type" val="D" />
		<set name="material" val="STEEL" />
		<set name="weight" val="205" />
		<set name="soulshots" val="1" />
		<set name="spiritshots" val="1" />
		<set name="is_tradable" val="false" />
		<set name="is_dropable" val="false" />
		<set name="is_destroyable" val="false" />
		<set name="is_depositable" val="false" />
		<set name="is_sellable" val="false" />
		<stats>
			<stat type="pAtk">92</stat>
			<stat type="mAtk">54</stat>
			<stat type="rCrit">8</stat>
			<stat type="accCombat">-3.75</stat>
			<stat type="pAtkSpd">325</stat>
			<stat type="randomDamage">10</stat>
			<stat type="pAtkRange">80</stat>
		</stats>
	</item>
</list>
