<?xml version="1.0" encoding="UTF-8"?>
<list xmlns:xsi="http://www.w3.org/2001/XMLSchema-instance" xsi:noNamespaceSchemaLocation="../../xsd/items.xsd">
	<item id="99357" name="Emerald Weapon: Rapier" type="Weapon">
		<set name="icon" val="BranchSys3.Icon.g_beam_sword" />
		<set name="default_action" val="EQUIP" />
		<set name="weapon_type" val="RAPIER" />
		<set name="bodypart" val="rhand" />
		<set name="immediate_effect" val="true" />
		<set name="crystal_type" val="B" />
		<set name="material" val="STEEL" />
		<set name="weight" val="144" />
		<set name="soulshots" val="1" />
		<set name="spiritshots" val="1" />
		<set name="is_sellable" val="false" />
		<set name="is_freightable" val="true" />
		<stats>
			<stat type="randomDamage">10</stat>
			<stat type="pAtkRange">40</stat>
		</stats>
	</item>
</list>
