<?xml version="1.0" encoding="UTF-8"?>
<list xmlns:xsi="http://www.w3.org/2001/XMLSchema-instance" xsi:noNamespaceSchemaLocation="../../xsd/items.xsd">
	<item id="33778" name="A-grade Soulshot" additionalName="Not Available" type="EtcItem">
		<!-- The item is not available. Take it to the Game Assistant to exchange for a new Soulshot. -->
		<set name="icon" val="icon.etc_ertheia2" />
		<set name="default_action" val="SOULSHOT" />
		<set name="immediate_effect" val="true" />
		<set name="crystal_type" val="A" />
		<set name="material" val="PAPER" />
		<set name="is_tradable" val="false" />
		<set name="is_dropable" val="false" />
		<set name="is_sellable" val="false" />
		<set name="is_stackable" val="true" />
	</item>
	<item id="33785" name="A-grade Spiritshot" additionalName="Not Available" type="EtcItem">
		<!-- The item is not available. Take it to the Game Assistant to exchange for a new Spiritshot. -->
		<set name="icon" val="icon.etc_ertheia2" />
		<set name="default_action" val="SPIRITSHOT" />
		<set name="immediate_effect" val="true" />
		<set name="crystal_type" val="A" />
		<set name="material" val="PAPER" />
		<set name="is_tradable" val="false" />
		<set name="is_dropable" val="false" />
		<set name="is_sellable" val="false" />
		<set name="is_stackable" val="true" />
	</item>
	<item id="33792" name="Blessed A-grade Spiritshot" additionalName="Not Available" type="EtcItem">
		<!-- The item is not available. Take it to the Game Assistant to exchange for a new Spiritshot. -->
		<set name="icon" val="icon.etc_ertheia2" />
		<set name="default_action" val="SPIRITSHOT" />
		<set name="immediate_effect" val="true" />
		<set name="crystal_type" val="A" />
		<set name="material" val="PAPER" />
		<set name="is_tradable" val="false" />
		<set name="is_dropable" val="false" />
		<set name="is_sellable" val="false" />
		<set name="is_stackable" val="true" />
	</item>
</list>
