<?xml version="1.0" encoding="UTF-8"?>
<list xmlns:xsi="http://www.w3.org/2001/XMLSchema-instance" xsi:noNamespaceSchemaLocation="../../xsd/items.xsd">
	<item id="20662" name="Agathion Uthanka" additionalName="Not Available" type="Armor">
		<!-- The item is not available. A bracelet for summoning Uthanka. -->
		<set name="icon" val="icon.etc_ertheia2" />
		<set name="default_action" val="EQUIP" />
		<set name="bodypart" val="lbracelet" />
		<set name="immediate_effect" val="true" />
		<set name="material" val="SILVER" />
		<set name="weight" val="150" />
		<set name="is_tradable" val="false" />
		<set name="is_dropable" val="false" />
		<set name="is_sellable" val="false" />
		<set name="is_premium" val="true" />
		<set name="is_oly_restricted" val="true" />
		<set name="is_freightable" val="true" />
		<skills>
			<skill id="21109" level="1" type="ON_EQUIP" /> <!-- Release Agathion's Seal - Uthanka -->
			<skill id="23087" level="1" /> <!-- Uthanka Agathion Cute Trick -->
			<skill id="3267" level="1" type="ON_UNEQUIP" /> <!-- Seal Agathion -->
		</skills>
	</item>
	<item id="20666" name="Valkyrie Hat" additionalName="Not Available" type="Armor">
		<!-- The item is not available. A hat endowed with the Valkyrie's power. <font color=eeaa22>Equipped in the left head accessory slot.</font> -->
		<set name="icon" val="icon.etc_ertheia2" />
		<set name="default_action" val="EQUIP" />
		<set name="bodypart" val="hairall" />
		<set name="immediate_effect" val="true" />
		<set name="material" val="WOOD" />
		<set name="weight" val="10" />
		<set name="is_sellable" val="false" />
		<set name="is_premium" val="true" />
		<set name="is_oly_restricted" val="true" />
		<set name="isAppearanceable" val="true" />
	</item>
	<item id="20678" name="Gatekeeper Hat" additionalName="Not Available" type="Armor">
		<!-- The item is not available. A hat worn by Gatekeepers. <font color=eeaa22>Equipped in the left head accessory slot.</font> -->
		<set name="icon" val="icon.etc_ertheia2" />
		<set name="default_action" val="EQUIP" />
		<set name="bodypart" val="hairall" />
		<set name="immediate_effect" val="true" />
		<set name="material" val="WOOD" />
		<set name="weight" val="10" />
		<set name="is_sellable" val="false" />
		<set name="is_premium" val="true" />
		<set name="is_oly_restricted" val="true" />
		<set name="isAppearanceable" val="true" />
	</item>
</list>
